{
  "schema_version": "1.0.0",
  "document": { "doc_id": "DOC-c6dc82ad" },
  "source": {
    "source_sha256": "c6dc82ad36e530c381aca1f237d79907bb3610cf05a2ceac5851c6257094b3e1",
    "source_size_bytes": 27,
    "source_format": "txt",
    "discovered_at": "2026-08-13T14:00:00Z",
    "inventory_id": "synthetic-inventory",
    "inventory_version": "1.0.0"
  },
  "processing": {
    "event_id": "EVT-d419a0b8936073f3",
    "doc_id": "DOC-c6dc82ad",
    "source_sha256": "c6dc82ad36e530c381aca1f237d79907bb3610cf05a2ceac5851c6257094b3e1",
    "operation": "MD_WITH_ASSETS",
    "tool": "synthetic-router",
    "tool_version": "1.0.0",
    "parameters_version": "1.0.0",
    "parameters": { "mode": "fixture" },
    "started_at": "2026-08-13T16:00:00Z",
    "completed_at": "2026-08-13T16:00:00Z",
    "status": "ABSTAINED",
    "abstention_reason": {
      "code": "INSUFFICIENT_STRUCTURAL_EVIDENCE",
      "message": "Synthetic fixture intentionally abstained.",
      "details": { "fixture": true }
    }
  },
  "derivative": null,
  "validation": {
    "validation_status": "NOT_VALIDATED",
    "validation_method": null,
    "warnings": ["NO_DERIVATIVE_PRODUCED"],
    "validated_at": null
  }
}
